{
    "$schema": "../../schemas/newspiece.schema.json",

    "slug": "aim-sosya-join-big-equipa",
    "title": "BIG EQUIPA add aiM and sosya",
    "date": "2026-01-23",
    "related": { "players": ["aim", "sosya"], "teams": ["big-equipa"] },
    "links": [
        { "name": "BIG EQUIPA Tweet", "url": "https://x.com/BIG_EQUIPA/status/2014731328869056900" },
        { "name": "BIG Tweet", "url": "https://x.com/BIGCLANgg/status/2014742387239596495" },
        { "name": "aim Retweet", "url": "https://x.com/aiMCS2_/status/2014742829004661082" },
        { "name": "sosya Retweet", "url": "https://x.com/sosyaoai/status/2014743469709787168" },
        { "name": "HLTV News", "url": "https://www.hltv.org/news/43700/big-equipa-add-aim-and-sosya" }
    ]
}
