{
    "$schema": "../schemas/newspiece.schema.json",

    "slug": "nip-impact-disband",
    "title": "NIP part ways with Impact roster",
    "date": "2025-12-15",
    "related": { "players": ["aim", "nayomy", "qiyarah", "vilga", "zana"], "teams": ["nip-impact"] },
    "links": [
        { "name": "NIPCS Tweet", "url": "https://x.com/NIPCS/status/2000581814113456483" },
        { "name": "aiM Retweet", "url": "https://x.com/aiMCS2_/status/2000584156321857601" },
        { "name": "Nayomy Retweet", "url": "https://x.com/Nayomy_cs/status/2000608323641786500" },
        { "name": "Qiyarah Retweet", "url": "https://x.com/Qiyarahcs/status/2000608325122077152" },
        { "name": "vilga Retweet", "url": "https://x.com/vilgaCS/status/2000604256601293186" },
        { "name": "Zana Retweet", "url": "https://x.com/zanaCS2/status/2000582663506211183" },
        { "name": "HLTV News", "url": "https://www.hltv.org/news/43455/nip-part-ways-with-impact-roster" }
    ]
}
